{
  "schema": "bettor-arena/pdf-loopx-harness-integration/v1",
  "source": {
    "title": "LLM 泛化：模型權重與 Harness",
    "page_count": 41,
    "source_class": "REQUIREMENT_HYPOTHESIS",
    "locator": "uploaded PDF, pages 1-41",
    "authority": "Input architecture proposal; never repository or runtime evidence"
  },
  "audit_subject": {
    "repository": "ed3c/bettor-arena",
    "commit": "77267aba27ad94dde85a4dbda7dacc70a3057fb0",
    "tree": "2083db19a1bd9e50e5e9015861190cf98a041a8a"
  },
  "verdict": {
    "state": "PARTIAL",
    "summary": "The current main contains a modular control plane, public ports, host-owned Skill execution, independent proof/control/mutation, Context Capsules, default-deny MCP, provider boundaries, and immutable receipts. It does not yet contain a canonical LoopX event ledger, LangGraph interrupt/resume runtime, evidence-bound episodic-memory distiller, full white/gray worker parity, or physical cloud/local canaries.",
    "full_physical_integration": "NOT_EXERCISED"
  },
  "requirements": [
    {
      "id": "LX-01",
      "pdf_pages": [1, 2],
      "requirement": "Agent-agnostic state kernel with Objective, Todos, Gates, Evidence, and Quota",
      "owner_modules": ["arena-core", "loop-runtime", "proof-kernel"],
      "state_machines": ["macro-composition", "micro-task", "proof-kernel"],
      "paths": [".arena/modules/arena-core/module.json", ".arena/modules/loop-runtime/module.json", ".arena/modules/proof-kernel/module.json", "loopctl/contract.json"],
      "deterministic_gates": [["python3", "scripts/gates/check_module_catalog.py"], ["python3", "scripts/arena_proof.py", "check"]],
      "status": "PARTIAL",
      "blockers": ["No canonical append-only LoopX event ledger or one schema combining Objective/Todos/Gates/Evidence/Quota exists on current main.", "Quota is expressed across bounded loops and host policy, not one canonical kernel contract."],
      "corrections": ["Do not treat .loopx/state.json as the only authority; generated locks, receipts, and runtime state remain separate."]
    },
    {
      "id": "LX-02",
      "pdf_pages": [2, 5],
      "requirement": "Host-owned hard constraints replace model self-reporting",
      "owner_modules": ["agent-runtime-integration", "proof-kernel"],
      "state_machines": ["skill-execution", "proof-kernel"],
      "paths": [".agents/skills/harness-wiki/scripts/run_portable_skill.py", ".agents/skills/harness-wiki/contracts/skill-execution-request.schema.json", "proof_workflow/control_skill_execution_entry.sh", ".arena/modules/agent-runtime-integration/module.json"],
      "deterministic_gates": [["python3", "scripts/check_agent_runtime_module.py"], ["sh", "proof_workflow/control_skill_execution_entry.sh"]],
      "status": "IMPLEMENTED",
      "blockers": [],
      "corrections": ["Raw shell strings are rejected; the runner emits a receipt and never writes LoopX state."]
    },
    {
      "id": "LX-03",
      "pdf_pages": [3, 5],
      "requirement": "Fail-fast multi-gate verification across linter, semantic/type checks, and tests",
      "owner_modules": ["proof-kernel", "arena-core"],
      "state_machines": ["proof-kernel", "micro-task"],
      "paths": ["proof_workflow", "scripts/gates", "tests", ".githooks/pre-commit"],
      "deterministic_gates": [["python3", "scripts/arena_proof.py", "check"], ["python3", "scripts/gates/check_module_catalog.py"]],
      "status": "PARTIAL",
      "blockers": ["There is no single task-scoped multi-gate schema that normalizes Linter/LSP/UnitTest observations for every worker.", "LSP pool/resource policy is not a current executable contract."],
      "corrections": ["Gate commands must be typed argv, not shell=True command strings."]
    },
    {
      "id": "LX-04",
      "pdf_pages": [5, 10],
      "requirement": "Quota exhaustion triggers durable HITL interrupt and resume",
      "owner_modules": ["arena-core"],
      "state_machines": ["human-admit", "macro-composition"],
      "paths": ["AGENTS.md", "docs/architecture/STATE_MACHINES.md"],
      "deterministic_gates": [["python3", "scripts/gates/check_agent_docs.py"]],
      "status": "NOT_IMPLEMENTED",
      "blockers": ["No LangGraph checkpointer/interrupt/resume adapter or subject-bound resume receipt exists on current main."],
      "corrections": ["A force_skip string is not authority; exceptions need an explicit Human Admit receipt, scope, reason, expiry, and follow-up."]
    },
    {
      "id": "LX-05",
      "pdf_pages": [7, 10],
      "requirement": "Web UI visualizes graph state, evidence, diffs, and HITL decisions",
      "owner_modules": ["arena-core"],
      "state_machines": ["observability"],
      "paths": ["data/module-proof", "data/mcp", "data/origins", "data/browser"],
      "deterministic_gates": [["python3", "scripts/arena_proof.py", "check"]],
      "status": "NOT_IMPLEMENTED",
      "blockers": ["Evidence artifacts exist, but no LoopX/LangGraph HITL console or SSE/WebSocket UI is implemented."],
      "corrections": ["UI projections must not become state authority."]
    },
    {
      "id": "LX-06",
      "pdf_pages": [10, 11, 20, 23, 35, 39],
      "requirement": "White-box and gray-box workers share one typed adapter boundary",
      "owner_modules": ["agent-runtime-integration", "loop-runtime"],
      "state_machines": ["agent-runtime", "context-capsule", "skill-execution"],
      "paths": [".arena/modules/agent-runtime-integration/module.json", ".arena/modules/loop-runtime/module.json", ".agents/skills/harness-wiki/modules/host-skill-compatibility.md"],
      "deterministic_gates": [["python3", "scripts/check_agent_runtime_module.py"], ["python3", "scripts/arena_context.py", "check"]],
      "status": "PARTIAL",
      "blockers": ["Current fixed drivers cover Claude Code and Codex CLI; current-subject Grok Build, Pi, OpenCode, and Ante canaries are absent or not exercised.", "Source visibility of a harness does not prove model/provider behavior."],
      "corrections": ["Every adapter must report trace completeness and opaque segments instead of inventing internal tool traces."]
    },
    {
      "id": "LX-07",
      "pdf_pages": [11, 16],
      "requirement": "Monolithic micro-cell preserves continuity while graph routing remains macro-level",
      "owner_modules": ["arena-core", "loop-runtime"],
      "state_machines": ["macro-composition", "micro-task", "context-capsule"],
      "paths": [".arena/contexts", "scripts/arena_context.py", "loop_wiki/evolve-perfect-seed-repo-factory"],
      "deterministic_gates": [["python3", "scripts/arena_context.py", "check"], ["python3", "scripts/arena_proof.py", "check"]],
      "status": "PARTIAL",
      "blockers": ["Context Capsules and bounded micro loops exist, but there is no explicit monolithic-cell lifecycle or handoff-loss benchmark."],
      "corrections": ["Do not persist raw private reasoning; persist evidence-bound observations, decisions, dead ends, and falsifiers."]
    },
    {
      "id": "LX-08",
      "pdf_pages": [11, 18],
      "requirement": "Episodic memory carries dead ends, quirks, hypotheses, and strategy across agents",
      "owner_modules": ["knowledge-providers", "proof-kernel"],
      "state_machines": ["provider-memory-proposal", "proof-kernel"],
      "paths": ["docs/knowledge-providers/contracts/memory-proposal.schema.json", "docs/knowledge-providers/providers/mem0.json", "docs/knowledge-providers/README.md"],
      "deterministic_gates": [["python3", "scripts/check_knowledge_providers.py"]],
      "status": "PARTIAL",
      "blockers": ["A proposal-only memory contract exists; no admitted distiller, retention/writeback runtime, or cross-agent live canary exists."],
      "corrections": ["Memory cannot override current source, ADRs, tests, receipts, or Human Admit; raw chain-of-thought is forbidden."]
    },
    {
      "id": "LX-09",
      "pdf_pages": [21, 22, 32, 33],
      "requirement": "Single-writer state authority prevents multi-worktree races",
      "owner_modules": ["agent-runtime-integration", "module-catalog"],
      "state_machines": ["skill-execution", "module-lifecycle"],
      "paths": [".agents/skills/harness-wiki/scripts/run_portable_skill.py", ".arena/locks/bettor-arena.lock.json"],
      "deterministic_gates": [["python3", "scripts/check_agent_runtime_module.py"], ["python3", "scripts/gates/check_module_catalog.py"]],
      "status": "PARTIAL",
      "blockers": ["The Skill runner explicitly does not write state, but a canonical single-writer append-only LoopX ledger is not implemented."],
      "corrections": ["Workers emit observations/receipts; only a trusted reducer may commit state."]
    },
    {
      "id": "LX-10",
      "pdf_pages": [18, 24, 35, 41],
      "requirement": "Cloud/local separation uses secret-free contracts and replaceable providers",
      "owner_modules": ["agent-runtime-integration", "environment-contracts"],
      "state_machines": ["runtime-binding", "origin-browser"],
      "paths": [".runtime-env", ".arena/modules/environment-contracts/module.json", "docs/runtime-env-integration.md"],
      "deterministic_gates": [["bun", "scripts/gates/check_environment_contracts.ts"], ["python3", "scripts/check_agent_runtime_module.py"]],
      "status": "PARTIAL",
      "blockers": ["Secret-free projection exists; physical local/cloud parity and named cloud sandbox providers remain not exercised."],
      "corrections": ["localhost, credentials, sessions, and browser profiles are execution-plane resources, not portable repository bytes."]
    },
    {
      "id": "LX-11",
      "pdf_pages": [24, 33],
      "requirement": "Worktree isolation, resource budgets, cleanup, and garbage collection are enforced",
      "owner_modules": ["loop-runtime", "agent-runtime-integration"],
      "state_machines": ["stateless-mcp", "skill-execution"],
      "paths": ["loopctl/mcp_core.ts", ".agents/skills/harness-wiki/scripts/run_portable_skill.py", "proof_workflow/control_skill_execution_entry.sh"],